,0
4584,The Other Side of the Moon
4585,The Star King
4592,Legends of Charlemagne or a Romance of the Middle Ages pcx
4594,Worlds of Tomorrow
4596,The Gods of the Egyptians Volume 2
4597,Nightmare Tales
4599,Murder on the Orient Express
4600,Thongor Fight the Pirates of Tarakus
4603,Lankar of Callisto
4607,The Artificial Man and Other Stories
4608,The Lost Continent
4610,A Princess of Mars
4611,The Sense of Wonder
4613,The Original Illustrated Sherlock Holmes
4614,The Curse of the Undead Classic Tales of Vampires and Their Victims
4616,GOLDEN CITIES FAR
4617,THE MAN WHO LOVED MARS
4620,From the Caves and Jungles of the Hindostan
4621,Tarzan
4622,LOS PERROS DE SKAITH
4623,Murder on the Orient Express
4624,13 For Luck
4630,The Adventures Of Sherlock Holmes
4633,Tower at the Edge of Time
4637,Nobel Prize Library Hemingway Hamsun Hesse
4640,The Complete Poems of Emily Dickinson
4647,Oliver Twist
4649,The Man Who Loved Mars
4650,Ghost and Horror Stories of Ambrose Bierce
4651,Pride and Prejudice
4652,Turkey
4663,The Shadow in the Glass
4666,Time War
4668,Selected Poems
4674,Egyptian Religion
4675,The Best of Edmond Hamilton
4676,Slender Fantasies
4680,Egyptian Magic
4682,Hotel Bertram
4683,FANTASTIC SEPTEMBER 1974
4688,The City Outside The World
4689,BEACHHEADS IN SPACE
4690,Future Tense
4691,Acts of Light
4693,the clocks
4694,WIND WIZARDS OF CALLISTO
4699,From The Caves And Jungles Of The Hindostan
4700,Black Legion of Callisto
4704,Le train bleu
4705,I CLASSICI DELLA FANTASCIENZA 009 LA SPADA DI RHIANNON
4708,Time to Come
4715,The Adventures Of Sherlock Holmes
4716,History of the Revolutions in Europe from the Subversion of the Roman Empire
4724,Swordsmen and Supermen
4725,Silent Spring
4727,Lanikar of Callisto
4728,Pellucidar
4729,LA ESPADA DE RHIANNON
4730,As the Green Star Rises
4732,Selected Poems
4736,The Black Star
4738,Pride and Prejudice
4740,BOOK MAILER FROM WORLD PUBLISHING
4743,New Worlds Science Fiction For Old
4746,Kothar and the Wizard Slayer
4751,Le Secret De Sinharat
4752,The Only Place We Live
4756,Civil War Stories
4757,At the Earths Core
4759,RESTLESS IS THE RIVER
4760,Thongor And The Wizard Of Lemuria
4765,The Warlord of Mars
4766,STRANGE PORTS OF CALL
4767,Time To Come
4769,The Age of Fable
4773,Little Dorrit
4775,Playground Friends
4779,Beyond The Gate Of Dream
4781,The Black Wheel
4782,Emma
4784,Tarzan the Invincible
4787,Beyond Time and Space
4790,The City Outside the World
4793,Nemesis
4798,JANDAR OF CALLISTO
4799,Pirates of Venus
4800,The Dance of Death
4804,Strange Ports of Call
4805,Adventures of Sherlock Holmes
4810,Tarzan and the Forbidden City
4811,THE CHRONICLES OF SOLAR PONS
4812,Great Expectations
4816,When the Green Star Calls
4817,The Shadow In The Glass
4819,Write It Right
4821,Organ Building and Design
4823,ATLANTIS The Antediluvian World
4827,On the Fringe
4828,The Adventures Of Sherlock Holmes
4831,Pride and Prejudice
4833,The Heads Of Cerberus
4835,Emma
4839,The Lost World
4840,THIEF OF LLARN
4842,The Age Of Fable Or The Beauties Of Mythology
4843,The Horror in the Museum and Other Revisions
4849,The Gothic Horror and Other Weird Tales
4852,The Man Who Loved Mars
4855,Emma
4856,The Only Place We Live
4857,Transformations of Myth Through Time
4862,The Lurker at the Threshold
4867,Hard Times
4868,Eseje
4869,Poems for Youth
4870,Spark Notes Oliver Twist
4871,THE SAINT DETECTIVE MAGAZINE 1957 SEPTEMBER
4874,The Chronicles of Solar Pons
4875,Bright Journey
4877,Sac Prairie People
4878,When the Green Star Calls
4881,When the Green Star Calls
4882,The Wind Leans West
4885,Atlantis the Antediluvian World
4889,A Princess of Mars
4892,The Ginger Star
4894,Bright Journay
4897,Masters of Horror
4898,The Age of Fable or Beauties of Mythology Volume III
4899,The Age of Fable
4906,Unheimliche Geschichten
4907,Studies in Occultism
4908,Great Expectations
4909,Age of Fable or Beauties of Mythology
4910,GINGER STAR
4911,A Collection of Essays
4920,Egyptian Religion
4922,The Age of Fable
4925,A Tale of Two Cities
4926,Life Of Our Lord
4929,Emily Dickinson Selected Poems
4931,MORE ADVENTURES ON OTHER PLANETS
4932,Stories for Summer
4935,RAGNAROK Age of Fire and Gravel
4936,An Occurrence at Owl Creek Bridge
4939,First Steps in Egyptian
4940,Great Expectations
4942,Cards of Grief
4943,Mystery of Edwin Drood
4944,Heroic War Stories
4945,The Milwaukee Road Its First Hundred Years
4946,The Age of Fable or Beauties of Mythology
4948,Sky Pirates of Callisto
4949,Time War
4951,Under the Green Star
4953,Love Poems
4954,Conan of Aquilonia
4955,Jandar of Callisto
4956,Pride And Prejudice And Zombies
4959,The Trojan War
4960,The Sword of Rhiannon
4961,Man Who Loved Mars
4965,The roar of the twenties
4966,Sky Pirates of Callisto
4968,The Age of Fable
4970,Christmas Carol
4971,The Paradox of Being
4976,Fantastic Story Magazine for Summer 1952
4977,Lankar of Callisto
4978,Egyptian Religion
4986,The Adventures of Sherlock Holmes
4987,The Trial Of Cthulhu
4992,The Coming of the Terrans
4997,Black Legion of Callisto
5000,The splendor that was Egypt
5002,Wisconsin Country A Sac Prairie Journal
5006,THRILLING WONDER STORIES FEBRUARY 1950
5013,The Age of Fable Or The Beauties of Mythology
5025,EGYPTIAN IDEAS OF THE FUTURE LIFE
5026,Nightmare Tales
5027,The Shadow in the Glass
5030,Columbus and the New World
5032,In The Midst of Life
5033,The Age of Fable
5034,A Christmas Carol
5035,Three Gothic Novels
5036,The Parasite
5038,Persuasion
5040,Northanger Abbey
5043,The Reminiscences of Solar Pons
5045,Conan Of The Isles
5050,The Age of Fable
5051,Les pillards de Skaith
5053,British Mystery Multipack 13
5055,Warlord of Mars
5068,From the Caves and Jungles of Hindostan
5070,FANTASTIC 1974 september
5071,The Adventures of Sherlock Holmes
5072,Return of Sherlock Holmes
5073,The Mask of Cthulhu
5074,The Age of Fable or Beauties of Mythology
5076,Egyptian Magic
5079,PERSUASION by JANE AUSTEN
5080,Hound of the Baskervilles
5081,Lankar of Callisto
5085,The Return of Tarzan
5087,The Age of Chivalry
5089,The Occult World
5092,Egyptian Magic
5093,Beachheads in Space
5095,Mythology
5097,AGE OF CHIVALRY OR KING ARTHUR AND HIS KNIGHTS
5098,Return of Sherlock Holmes
5099,Mysterious Adventures of Sherlock Holmes
5100,The Hounds of Skaith
5101,Beyond The Gate Of Dream
5106,Emily Dickinson
5107,Time War
5108,Best of Leigh Brackett
5111,Survivor and Others
5117,The Adventures of Sherlock Holmes
5119,Lost World of Time
5120,The Quest Of Kadji
5121,the Age of Fable or Stories of Gods and Heroes
5122,More Adventures on Other Planets
5127,The City Outside the World
5128,Nightmare Tales
5129,The House on the Mound
5132,The Trail of Cthulhu
5135,The City Outside the World
5138,The Mummy Chapters on Egyptian Funeral Archaeology
5141,Adventures of Sherlock Holmes
5142,Tarzan and the Jewels of Opar
5144,New lands
5148,The Gods of Mars
5150,Elephants Can Remember
5152,Egyptian Religion Egyptian Ideas of the Future Life
5154,The Book Of The Dead
5157,An Overdose of Death
5159,An Egyptian Hieroglyphic Reading Book for Beginners
5160,The Coming of the Terrans
5162,TOWER AT THE EDGE OF TIME
5169,Pirates of Venus
5171,The Vampyre
5174,POEMS THAT THAT TOUCH THE HEART
5176,By the light of the Green Star
5177,The memoirs of Sherlock Holmes
5182,The Age Of Fable Or Beauties Of Mythology
5183,Tarzan of the Apes
5184,By the Light of the Green Star
5188,Mothman Prophecies
5193,A Hearse of a Different Color
5194,Mysterious Erotic Tales
5201,Pride and prejudice
5203,Illustrated Sherlock Holmes Treasury
5211,Return to Walden West
5219,Tales of Horror and the Supernatural Volume 1
5220,Return to Walden West
5221,Book Of The Dead
5224,SHE BEING DEAD YET SPEAKETH And Twelve Other Articles
5228,New Poems of Emily Dickinson
5230,Passenger to Frankfurt
5231,Selected Poems of Emily Dickinson
5235,THE SECRET OF SINHARAT bound with PEOPLE OF THE TALISMAN
5236,Country Places
5238,Egyptian Language
5240,SKY PIRATES OF CALLISTO
5245,Great Expectations
5249,The Complete Poems of Emily Dickinson
5250,The Lad and the Lion
5251,La Huella De Cthulhu
5254,Ghosts and Things
5256,Tarzan the Untamed
5257,EMILY DICKINSON
5260,Collected Writings of Ambrose Bierce
5268,KING KULL
5269,Worlds of Tomorrow
5270,Under the Green Star
5272,A Treasury of Sherlock Holmes
5273,VILLAGE DAYBOOK
5286,The Laurel Poetry Series Emily Dickenson
5287,KAR KABALLA and TOWER OF THE MEDUSA
5291,Thongor Fights the Pirates of Tarakus
5292,Men Against the Stars
5293,Warlord of Mars
5294,Sword Woman
5295,Wind over Wisconsin
5298,The Hounds of Skaith
5301,sleeping murderthe murder at the vicarage
5309,THE STARMAN OF LLYRDIS
5310,Curtain
5313,Walden West
5314,The Lost Continent
5319,Black Legion of Callisto
5320,The Hounds of Skaith
5324,If Science Fiction Magazine March 1968
5325,Strange Ports of Call
5326,A Christmas Carol
5327,The Sword of Rhiannon
5328,Paper Magic
5330,Final Harvest
5331,FANTASTIC STORY 1952 SUMMER
5332,Babylonian Tablets in the British Museum Part VI I
5333,Death In the Air
5339,WEIRD TALES MAY 1948
5341,The Reavers of Skaith
5342,Father Marquette and the Great Rivers
5343,Age Of Chivalry Legends Of Charlemagne
5346,The Travels of Sir John Mandeville
5350,Fantastic Fables
5352,Preussentum Und Sozialismus
5354,A POCKET FULL OF RYE
5356,Emily Dickinsons Poems
5361,Tale of Two Cities
5363,The Age of Fable or the Beauties of Mythology
5364,As the Green Star Rises
5365,THE AGE OF FABLE
5366,MIND WIZARDS OF CALLISTO
5368,Tarzan and the Golden Lion
5371,In the Midst of Life Tales of Soldiers and Civilians
5373,Evil under the Sun
5377,Ghost and Horror Stories of Ambrose Bierce
5378,The Age of Fable or the Beauties of Mythology
5379,THE MAGAZINE OF FANTASY AND SCIENCE FICTION FALL 1950
5380,Persuasion
5383,Beyond the Gates of Dream
5384,BEYOND THE GATES OF DREAM
5395,One Hundred and One Famous Poems
5397,Complete Poems of Emily Dickinson
5398,The Adventures Of Sherlock Holmes
5399,The Return of Tarzan
5402,The Murders
5404,The Lost World
5408,Christmas Stories
5410,FATHER MARQUETTE AND THE GREAT RIVERS
5413,Name That Dinosaur
5415,Emily Dickinson Selected Poems
5417,THE BEASTS OF TARZAN
5420,Life Of Our Lord
5425,Savage Pellucidar
5426,SPACE ADVENTURES SUMMER 1971
5427,TIME WAR
5428,The First Men in the Moon
5430,A Christmas Carol
5431,LA HABITACION CERRADA Y OTROS CUENTOS DE TERROR
5433,The Rosetta Stone
5439,DWELLERS IN DARKNESS
5442,BLACK LEGION OF CALLISTO
5443,The Raven
5444,Selected Poems of Emily Dickinson
5445,Tower at the Edge of Time
5446,LES PILLARDS DE SKAITH
5448,18 Best Stories by Edgar Allan Poe
5450,Tanar of Pellucidar
5452,HOUND OF THE BASKERVILLES NEW Edition
5453,The Age Of Fable
5454,Le chien des Baskerville
5460,Poems by Emily Dickinson
5462,The Civil War Short Stories of Ambrose Bierce REPRINT Edition
5463,The Unvanquished V351
5464,Time to Come
5465,Pirates of Venus
5466,Love Poems
5473,Sky Pirates of Callisto
5478,The Book of the Bee
5481,A Christmas Carol
5483,For Love of Her
5484,Great Short Stories of the World
5485,ASTOUNDING FEBRUARY 1942
5488,THE REMINISCENCES OF SOLAR PONS
5489,In the Midst of Life
5494,Tarzan of the Apes
5496,An Occurence At Owl Creek Bridge And Selected Stories
5498,Bolts of Melody New Poems of Emily Dickinson
5501,HOUNDS OF SKAITH
5504,A Christmas Carol
5505,Egyptian Ideas of the Future Life
5507,Outworlder
5510,astonishing stories pulp magazine 1943 february
5513,The Age of Fable or Beauties of Mythology
5514,Selected Poems of Emily Dickinson
5515,The Sardonic Humor of Ambrose Bierce
5521,Jandar of Callisto
5526,The Gold of the Gods
5527,Egyptian Religion
5534,CURTAIN
5537,Thongor at the End of Time
5540,The Chessmen of Mars
5544,Frankenstein
5546,Adventures of Solar Pons
5547,Egyptian Magic
5548,The Mummy
5549,The Ginger Star
5556,The Vampyre
5557,Le peuple du talisman
5558,The Starmen of Llyridis
5561,My Lord Barbarian
5565,The Girl with the Hungry Eyes and Other Stories
5568,Complete Poems of Emily Dickinson Controlled Release
5573,Beyond Time and Space
5574,The Chessmen of Mars
5575,The Silver Eggheads
5578,The Hounds of Skaith
5580,A Princess of Mars
5581,The Waste Land and Other Poems
5583,EGYPTIAN LANGUAGE Easy Lessons in Egyptian Hieroglyphics with Sign List
5585,Le Peuple du talisman
5586,Age of Chivalry
5590,ELEPHANTS CAN REMEMBER
5595,The Complete Poems of Emily Dickinson
5596,The Lad and the Lion
5597,The Sardonic Humor of Ambrose Bierce
5599,The English Assassin
5601,The Wind Leans West
5603,A Caribbean Mystery
5609,Poems for Youth
5610,Great Expectations
5614,TIME TO COME
5615,The Sardonic Humor of Ambrose Bierce
5618,The Sardonic Humor of Ambrose Bierce
5624,The Complete Old English Sheepdog
5625,THONGOR IN THE CITY OF MAGICIANS
5626,Collected Poems of Emily Dickinson
5627,Love and Friendship and Other Early Works
5629,History of Arabia Ancient and Modern Volume II
5633,Death in the Air
5638,From the Caves and Jungles of Hindostan
5643,THE ARKHAM COLLECTOR
5644,The Body in the Library
5645,BEST OF LEIGH BRACKETT
5647,The Wind Leans West
5648,Walking
5649,The Ginger Star
5650,Organ Building and Design
5652,The Warlord of Mars
5655,Pride and Prejudice and Zombies
5656,The Man Who Loved Mars
5661,Great Expectations
5663,Sleeping Murder
5664,THONGOR OF LEMURIA
5672,The Reminiscences of Solar Pons
5674,The Mummy
5677,Lori
5679,The People Of The Mist
5683,Tarzan of the Apes TV Show Cover
5687,Curtain
5689,The Age of Fable or Beauties of Mythology
5693,Persuasion
5694,Vettius and His Friends
5696,Other Worlds Science Stories March 1952
5697,CONAN THE BARBARIAN
5698,The Valley Where Time Stood Still
5700,The Complete Poems of Emily Dickinson
5705,TARZAN OF THE APES
5707,Nemesis
5711,Oliver Twist
5712,Collected Poems of Emily Dickinson
5714,The Unvanquished V351
5718,Murder in our midst
5719,Shadow of Night
5723,The Secret of Chimneys
5728,The Hounds Of Skaith
5730,Sky Pirates of Callisto
5733,The Empire Strikes Back
5734,Great Shadow
5737,The 2nd Avon Fantasy Reader
5738,Arabian Nights
5743,Ghosts Know
5744,The Complete Old English Sheepdog
5746,Elephants Can Remember
5750,Krieg der Unsterblichen
5754,Columbus and The New World
5756,Enchantress of Venus in Planet Stories Fall 1949
5757,Favorite Poems of Emily Dickinson
5759,An Egyptian Reading Book
5765,The Voice of the Silence
5768,A Christmas Carol
5771,Pullucidar
5772,The Chessmen of Mars
5777,THE ARKHAM COLLECTOR
5782,The Lad and the Lion
5784,The Hound of the Baskervilles
5786,Babylonian Life and History
5788,Journey to the Underground World
5789,Taarzan the Untamed
5791,Postern of Fate
5793,THONGOR IN THE CITY OF MAGICIANS
5800,I Am a Barbarian
5803,A Princess of Mars
5806,THE SHIELD OF THE VALIANT
5808,Ordeal By Innocence
5809,The Adventures Of Sherlock Holmes
5815,the clocks
5817,A Christmas Carol
5820,Aladino
5821,The Wizard of Zao
5822,The Trojan War
5830,Selected Poems and Letters of Emily Dickinson
5831,Pride and Prejudice
5834,The Theosophical Glossary
5843,Time to Come
5847,Night World
5848,The Waste Land and Other Poems
5851,Feast of Fear
5852,The Adventures of Sherlock Holmes
5854,WEIRD TALES MAY 1949
5856,Hobbit or There and Back Again
5859,Pride and Prejudice and Zombies
5863,The Poems of Emily Dickinson
5866,The Adventures of Sherlock Holmes
5869,Sumerian And Assyrian Herbals
5870,Le masque de Cthulhu
5872,Master Mind of Mars
5874,Six Great Sherlock Holmes Stories
5875,Invasion 1996
5876,Sleeping Murder
5877,Tarzan and the Madman
5881,Selected Poems of Emily Dickinson
5886,The Black Stallion Mystery
5888,The Warlord of Mars
5889,MAGAZINE OF FANTASY AND SCIENCE FICTION 1953 JULY
5895,The Hound of the Baskervilles
5897,Oliver Twist
5903,Beyond the Gates of Dream
5906,Conan The Buccaneer
5907,Return To Walden West
5908,The Lost World
5909,Figures of Earth
5911,The Big Jump
5912,Conan of the Isles
5914,Lankar of Callisto
5918,They Came To Bagdad
5919,The Hound of the Baskervilles
5922,Science Fiction Stories 8
5924,Hounds of Skaith
5925,Casebook Of Carnacki The Ghost Finder NEW ED
5927,Beachheads in Space
5928,Time War
5933,Egyptian Religion
5934,The Babylonian Legends of Creation
5935,Pride and Prejudice and Zombies
5940,The Coming of the Terrans
5943,Egyptian Magic
5944,WALDEN WEST
5949,People Of The Talisman
5950,Seven American short stories
5952,The Travels of Sir John Mandeville
5953,7 Dials Mystery
5962,The Adventures of Tom Sawyer
5964,Pride and Prejudice and Zombies
5966,PELLUCIDAR
5967,Two Poems by Emily Dickinson
5968,Quick Check Food Facts
5970,Poems
5974,THE GINGER STAR
5975,Le masque de cthulhu
5977,Great Expectations
5984,Horror Hunters
5985,LA HABITACION CERRADA Y OTROS CUENTOS DE TERROR
5988,The Big Jump
5989,Christmas Carol
5992,REAVERS OF SKAITH
5994,Quest of Kadji
5995,The Outer Reaches
5996,Tarzan and the Lost Empire
5997,The Complete Sherlock Holmes
5998,Postern of Fate
6000,Thongor against the Gods
6004,Selected Poems
6005,Magic Fishbone
6007,The Beasts of Tarzan
6009,MAD EMPRESS OF CALLISTO
6013,Pasajero Para Francfort
6014,SKY PIRATES OF CALLISTO
6025,THE ADVENTURE OF THE UNIQUE DICKENSIANS
6028,LA ESPADA DE RHIANNON
6029,BEYOND BELIEF
6032,Ecce And Old Earth
6034,The Cave Girl
6035,The Black Wheel
6038,At the Earths Core
6039,Life Of Our Lord
6040,Time War
6041,The Wind Leans West
6044,Complete Poems of Emily Dickinson Controlled Release
6045,The Chronicles if Solar Pons
6059,The case book of Sherlock Holmes
6060,Death of a Salesman
6062,A Wisconsin Harvest
6063,Poems of Faith
6065,Uncollected Stories of William Faulkner
6066,The Pocket Emily Dickinson
6067,Stories and Fables
6068,THE REAVERS OF SKAITH
6069,Grundtvig Som Rigsdagsmand of Andre Afhandlinger
6070,The Coming of the Terrans
6072,Cobwebs from an Empty Skull
6074,Other Worlds Science Stories October 1951
6077,The Quest of Kadji
6083,The Sign of the Four
6088,From Other Worlds
6089,The Age of Fable
6090,Collected Poems of Emily Dickinson
6091,Tales of Soldiers and Civilians
6092,The Master Mind of Mars
6097,Ecce And Old Earth
6098,The Original Illustrated Sherlock Holmes
6099,BIG JUMP
6102,Pride and Prejudice
6103,A Holiday for Murder
6106,Sparkling Cyanide
6110,From the Caves and Jungles of Hindostan
6112,Death on the Nile
6114,Conan the Wanderer
6117,In the Midst of Life
6119,House on the Mound
6120,The Wizard of Lemura
6121,Death of a Salesman
6122,Favorite Poems of Emily Dickinson
6124,King Dragon
6137,Collected Poems of Emily Dickinson
6138,Tarzan and the Jewels of Opar
6140,The Reavers of Skaith
6141,The Secret Adversary
6142,At Bertmans Hotel
6144,A World Is Born
6147,Northanger Abbey
6152,Thongor at the End of Time
6154,Hound of the Baskervilles
6164,Invisible Death
6165,Bright Journey
6166,Complete poems of Emily Dickinson
6168,Three Times Infinity
6169,Conan the Swordsman
6174,The Lord of the Rings
6176,The Starmen
6179,The Outlaw of Torn
6182,Down to a Sunless Sea
6183,MAD EMPRESS OF CALLISTO
6187,A Murmur in the Trees
6188,The Ginger Star
6189,Egyptian Magic
6191,The Starman of Llyrdis
6193,A Cynic Looks at Life
6194,Pride And Prejudice And Zombies
6195,The Memoirs of Solar Pons
6198,The Long Tomorrow
6200,The Age of Fable Or The Beauties of Mythology
6206,The Return of Sherlock Holmes
6207,DEMON IN THE MIRROR by ANDREW OFFUTT AND RICHARD LYON
6210,The Egyptian Book of the Dead
6211,Thongor at the End of Time
6223,The Wizard of Zao
6224,HOUNDS OF SKAITH
6226,The Great Short Works of Herman Melville
6228,The Warlord of Mars
6229,The Miracle of Christmas
6233,Homer and His Age
6235,Dragonrouge
6236,Le masque de Cthulhu
6237,The Man Who Loved Mars
6239,WHEN THE GREEN STAR CALLS
6241,The Country of The Hawk
6243,A Christmas Carol With Free Website Extras
6246,In the Midst of Life
6247,Towards Zero
6248,A Feast Of Blood
6251,Nazareth Hill
6253,Startling Stories for July 1951
6255,THONGOR AGAINST THE GODS
6256,And Then There Were None
6257,WEIRD TALES MARCH 1952
6259,Ghost and Horror Stories of Ambrose Bierce
6261,The Fickle Finger Of Fate
6263,The Book of the Dead
6265,And Then There Were None
6267,imagination stories of science and fantasy digest size magazine 1953 april
6268,Emily Dickinson
6270,Walden West
6271,The Book of the Dead
6272,Beyond The Gate Of Dream
6273,The Hounds Of Skaith 2
6278,THE AGE OF FABLE BY THOMAS BULFINCH
6281,Beyond the Gate of Dream
6284,Shadow in the Glass
6285,The Long Tomorrow
6289,Sense and Sensibility
6290,Great Stories of Sherlock Holmes
6292,The Complete Poems of Emily Dickinson
6293,Bartleby and Benito Cereno
6296,Oliver Twist
6297,Complete Poems of Emily Dickinson Controlled Release
6300,The Black Star
6301,THE GINGER STAR
6305,When the Green Star Calls
6307,The Complete Poems of Emily Dickinson
6314,An Eye for an Eye
6321,Cuneiform Texts From Babylonian Tablets in the British Museum Part XX
6326,THE CITY OUTSIDE THE WORLD
6327,Pride and Prejudice
6329,The House on the Mound
6331,Selected Poems
6334,The Collected Poems of Emily Dickinson
6336,The Adventures of Sherlock Holmes
6337,New lands
6340,RESTLESS IS THE RIVER
6344,venture science fiction digest size magazine 1957 november
6345,The Magic of Atlantis
6348,An Eye For An Eye
6352,Tarzan the Invincible
6353,Hard Times
6355,Black Legion of Callisto
6357,Famous Tales of Sherlock Holmes
6363,Healing Poetry
6364,Hard Times
6369,Les chiens de skaith
6372,Lankar of Callisto
6373,The Book of the Bee
6374,Life Of Our Lord
6382,The Poems of Emily Dickinson
6383,Christian Science
6384,Selected Short Stories of Nathaniel Hawthorne
6389,The Unvanquished V351
6392,The Hound of the Baskervilles
6393,Nemesis From Terra
6396,Graphic Classics Gothic Classics
6398,Beachheads In Space
6399,Adventures of Sherlock Holmes
6401,The Nemesis from Terra
6402,The Complete Poems of Emily Dickinson
6404,Nemesis
6407,The coming of the Terrans
6409,Selected Poems of Emily Dickinson
6410,The Other Side of Tomorrow
6413,Lost On Venus
6416,The Mask of Cthulhu
6417,The Further Adventures of Sherlock Holmes
6418,The Gold of the Gods
6419,Thirteen at Dinner
6423,The Icleand Fisherman
6426,Worlds Of Tomorrow November 1966
6427,Studies in occultism
6430,The Coming of the Terrans
6431,Pride and Prejudice
6434,The Lost World
6435,Myths to Live By
6437,Emma
6438,WALDEN WEST
6439,Someone in the Dark
6443,A Tale of Two Cities
6444,The Rosetta Stone
6445,An Occurrence at Owl Creek Bridge and Other Stories
6446,The Wisconsin River of a Thousand Stars
6447,A Charles Dickens Christmas
6450,Queen of the Martian Catacombs
6452,Thonger at the End of Time
6454,The First Men in the Moon
6458,The Nemesis of Evil
6461,Death of a Salesman
6462,Sherlock Holmes and the Mystery of Boscombe Pool
6463,The Hounds of Skaith
6466,Twice in Time
6468,Trumps of Doom
6471,The Collected Writings of Ambrose Bierce
6474,The Hound of the Baskervilles
6475,Light in August
6477,An August Derleth Reader
6480,Passenger to Frankfurt
6483,Lost World of Time
6486,The Coming Of The Terrans
6487,Le Peuple du talisman
6488,West of Morning
6490,Seven Dials Mystery
6491,A Princess Of Mars
6495,The Cocktail Party
6499,A Study in Scarlet
6500,The Age of Fable or the Beauties of Mythology
6501,Black Amazon of Mars
6505,The Hound Of The Baskervilles
6507,For Love of Her
6508,Tarzan of the Apes
6510,The Hound of the Baskervilles
6513,Thirteen at Dinner
6516,The Shield of the Valiant by August Derleth
6518,THE CHESSMEN OF MARS
6520,The Hound of the Baskervilles
6521,Poirot joue le jeu
6530,THONGOR FIGHTS THE PIRATES OF TARAKUS
6531,Alpha Centauri or Die
6534,SKY PIRATES OF CALLISTO
6537,On the Fringe
6539,The Man Who Loved Mars
6541,THE SWORD OF RHIANNON
6543,Return to Walden West
6548,TOWER AT THE EDGE OF TIME
6549,Conan of the Isles
6550,A Christmas Carol
6551,Tarzan of the Apes
6553,MURDER IN THREE ACTS
6554,Le Peuple du talisman
6556,The Best War Stories
6557,Life Of Our Lord
6558,The Mummy
6560,The Chronicles of Solar Pons
6561,Three Times Infinity
6562,Pride and Prejudice
6568,Flare
6571,Startling Stories Spring 1954
6572,When the Green Star Calls
6574,Why Ufos
6576,Praktischer Okkultismus
6578,Egyptian Magic
6581,Tarzan the Magnificent
6583,Age of Fable
6585,Man Who Loved Mars
6586,Pride and Prejudice and Zombies
6587,Transformations of Myth Through Time
6589,The Warlord of Mars
6590,Black Legion of Callisto
6593,THE AGE OF FABLE OR BEAUTIES OF MYTHOLOGY
6595,The Gold of the Gods
6600,Spark Notes Oliver Twist
6601,FAMOUS FANTASTIC MYSTERIES FEBRUARY 1948
6606,Complete Short Stories Volume 2
6607,From Other Worlds
6609,Persuasion
6611,THE BEASTS OF TARZAN
6612,The Lost World
6613,Renegade of Callisto Volume 8 in Calisto
6616,Tales of Soldiers and Civilians
6619,The Lost World
6622,More Strange Events
6623,Northanger Abbey
6625,Lost World of Time
6630,The Long Tomorrow
6631,The Shadow in the Glass
6632,Passenger to Frankfurt
6633,THE AGE OF FABLE Or Beauties of Mythology
6639,The Original Illustrated Sherlock Holmes
6642,Elephants Can Remember
6643,The Nemesis of Evil
6644,The Lost World
6648,Portals of Tomorrow
6653,TAU ZERO
6654,THE BEST OF EDMOND HAMILTON
6655,From the Caves and Jungles of Hindostan
6660,Ethiopian Magical Names Of God And Their
6661,Mansfield Park
6662,THONGOR IN THE CITY OF MAGICIANS
6664,Pride and Prejudice and Zombies
6665,The Blood Red Game
6666,SKY PIRATES OF CALLISTO
6667,Hungry Time Eight Science Fiction Fables
6670,Egyptian Magic
6671,The Big Jump
6672,The Man Who Loved Mars
6673,The Dead World
6675,Sky Pirates Of Callisto
6676,Great Expectations
6677,Phantom Coach
6679,Collected Poems of Emily Dickinson
6680,THREE TIMES INFINITY
6684,THONGER AT THE END OF TIME
6686,The Age of Chivalry
6687,The Best of Leigh Brackett
6688,My Lord Barbarian
6692,HALFLING AND OTHER STORIES
6693,Poiret E La Salma
6694,One Hundred and One Famous Poems
6698,Mark of the Cat
6701,Grave Expectations
6702,Swordsmen and Supermen
6703,Black Legion of Callisto
6705,The Coming of the Terrans
6706,Mind Wizards of Callisto
6707,THE STARMEN OF LLYRDIS
6709,A LETTER TO JUDITH
6712,As You Like It
6715,Mysterious Adventures of Sherlock Holmes
6718,astonishing stories pulp magazine 1943 february
6722,The Sardonic Humor of Ambrose Bierce
6723,Men of the Deep Waters
