,0
1,A Collection of Essays
4,Thongor Against the Gods
5,BOOK MAILER FROM HOUGHTON MIFFLIN
7,The Shuttered Room and Other Tales of Horror
11,When the Green Star Calls
12,THE GOD OF THE WITCHES
13,Three Gothic Novels
14,Lost World of Time
16,Mystery of the White Monkeys
17,The Age of Chivalry and Legends of Charlemagne or Romance of the middle Ages
27,The Shadow in the Glass
32,Tower at the Edge of Time
39,Emily Dickinson
40,Great Expectations
42,The Cocktail Party
47,Fantastic Fables
49,The Dancers of Noyo
50,Journey to the Underground World
51,The Lord of the Rings
53,Columbus and the New World
55,The Night of the Wolf
58,Tarzan Triumphant
61,Favorite Poems of Emily Dickinson
62,On the Fringe
65,THONGOR AGAINST THE GODS
68,Bolts of Melody
73,The City Outside The World
76,Worlds of Tomorrow
77,Lars Bo
79,Outworlder
88,TIME TO COME
89,The lurker at the threshold
90,Hard Times
92,The Moon Tenders
93,The Only Place We Live Wood Engravings by Frank Utpatel
97,Passenger to Frankfurt
105,Girl Behind the Door
106,Knight of Shadows
109,Postern of Fate
112,The Sword of Rhiannon
120,THE STARMEN OF LLYRDIS
124,New Worlds for Old
127,Thirteen at Dinner
128,Tarzan the Untamed
132,Legends of the Gods
133,The Sword Woman
134,The Coming of the Terrans
137,Thongor at the End of Time
141,Swords Against Tomorrow
143,The Shadow in The Glass
146,Favorite Poems of Emily Dickinson
153,Nights Yawning Peal
158,LES PILLARDS DE SKAITH
162,The Shadow in the Glass
166,Titans Tochter
167,The Other Side Of The Moon
169,A Murder is Announced
170,The Long Tomorrow
171,FANTASTIC ADVENTURES PULP MAGAZINE 1945 april
175,Ginger Star
176,Emma
178,The Age of Fable
180,Father Marquette and the Great Rivers
182,Legends of Charlemagne
191,When the Green Star Calls
192,Conan The Wanderer
199,The Age of Fable
200,GLI SLAN 023 LA STELLA AMARA
204,Civil War Stories
207,The Hounds of Skaith
209,THE NEMESIS FROM TERRA bound with COLLISION COURSE
210,Poems the Whole World Loves
211,The Memoirs of Sherlock Holmes
213,The Age of Chivalry
215,Great Expectations
216,Selected Poems of Emily Dickinson
218,The Son of Tarzan
219,Tower at the Edge of Time
221,Collected Poems of Emily Dickinson
224,The Age of Fable or The Beauties of Mythology
228,Lost World
230,As the Green Star Rises
232,Victorian Lace Fancy Work and Fantasies F 212
235,Study in Scarlet and Other Sherlock Holmes Stories
236,Invisible Death
239,The Long Tomorrow
243,Planets of Wonder
245,Emily Dickinson
248,Mind Wizards of Callisto
253,Les hommes stellaires
256,Vettius and His Friends
257,The Complete Novels of Jane Austen
258,The Beasts of Tarzan
260,Tales of Soldiers and Civilians in Slipcase
261,Jandar of Callisto
263,The Other Side of the Moon
267,Under the Green Star
275,The Poems of Emily Dickinson
279,One Hundred and One Famous Poems
283,Alpha Centauri or Di
291,pension Vanilos
293,Thrilling Wonder Stories February 1950
295,Death Comes As the End
296,The Trail of Cthulhu
299,The Vampyre
300,Atlantis the Antediluvian World
303,The Big Jump
308,English Country House Murders
309,WALDEN WEST
312,LANKAR OF CALLISTO
316,Master Mind of Mars
317,Ich war das Opfer
320,The Mummy
323,When the Green Star Calls
329,Bartleby and Benito Cereno
332,Age Of Chivalry Legends Of Charlemagne
334,Thrilling Science Fiction July 1975
337,Science Fiction of the Thirties
339,The Wind Leans West
340,Governmental Habit
343,Best of Weird Tales
345,Master Mind of Mars
349,EGYPTIAN MAGIC
351,Swords Against Wizardry
354,By the Pricking of My Thumbs
355,Murder on the Orient Express
358,The Sardonic Humor of Ambrose Bierce
359,The Adventures of Solar Pons
361,Organ Building and Design
365,Beyond Time and Space
366,Swordsmen and Supermen
368,The Return of the King
369,Complete Sherlock Holmes
372,The Age of Fable Or The Beauties of Mythology
375,Twenty Thousand Leagues Under the Sea
376,Christmas Carol
379,The Martyrdom of Saint George of Cappadocia
380,Tales of Haunted Houses
382,Cuneiform Texts From Babylonian Tablets in the British Museum Part XXXIII
383,Changewar
385,New Poems of Emily Dickinson
386,Postern of Fate
387,The Book of the Dead
396,The Best of Leigh Brackett
401,The Country of the Hawk
403,The Mucker
404,The Body in The Library
410,The Hobbit
413,THE REMARKABLE DINGDONG
415,The Adventure of the Snitch in Time
420,The Wizard of Zao
421,Sense and Sensibility and Sea Monsters
422,BEYOND THE GATES OF DREAM
423,AWARD SCIENCE FICTION READER
424,Memoirs of Sherlock Holmes
425,Worlds of Tomorrow
426,La voix de skaith Brackett Leigh
429,The Sword of Skelos
435,THE TIME OF INFINITY
436,Evil under the Sun
438,Aziyade
442,The Age of Arthur and His Knights of the Round Table
444,Mind Wizards of Callisto
445,Oliver Twist
448,Dwellers in the Mirage
449,Nightmare Tales
451,The Nemesis of Evil
453,Sweet Land of Michigan
454,On the Fringe
458,Pride and Prejudice
459,Adventures of Solar Pons
461,The Age of Fable or Beauties of Mythology
463,The Adventures Of Sherlock Holmes
464,THE BEST OF EDMOND HAMILTON
467,Tower at the Edge of Time
468,Pride and Prejudice and Zombies
471,The Warlord of Mars
486,The Civil War Short Stories of Ambrose Bierce REPRINT Edition
491,The Devils Dictionary
492,Mansfield Park
494,Selected Tales and Sketches
495,Swords of Mars
496,FANTASTIC AUGUST 1976
498,Selected Poems
500,Startling Stories for March 1951
502,GREAT EXPECTATIONS by CHARLES DICKENS
503,Remembered Death
505,Death in the Air
509,The Other Side of the Moon
511,Three Times Infinity
512,FANTASTIC ADVENTURES SEPTEMBER 1950 VOLUME 12 NUMBER 9
514,Organ Building and Design
515,Write It Right A Little Blacklist of Literary Faults
516,Black Legion of Callisto
517,The Lurker at the Threshold
518,Book Of The Damned
519,Vettius and His Friends
520,Unpublished Poems Of Emily Dickinson
521,Organ Building and Design
524,Mythology
528,The Complete Poems of Emily Dickinson
536,The Age of Fable or Beauties of Mythology
540,A Fighting Man of Mars
542,Judge Tenderly of Me
549,The Adventures of Sherlock Holmes
551,Sleeping Murder
552,The Hound of the Baskervilles
553,Sky Pirates of Callisto
556,The Big Jump
559,Ten great mysteries
560,THE GINGER STAR
562,CliffsNotes Pride and Prejudice
566,His Last Bow
567,Selected Essays
574,RATAS EN LAS PAREDES
584,The Hound of the Baskervilles
588,Cuneiform Texts From Babylonian Tablets in the British Museum Part XXI
589,STARTLING STORIES JULY 1951
590,Age Of Fable
592,At Bertrams Hotel
598,Tarzan and the Ant Men
599,Thongor In The City Of Magicians
602,Bleak House
604,Beware More Beasts
606,Father Marquette And The Great Rivers
607,Hound of the Baskervilles
611,The Memoirs of Sherlock Holmes
614,TOWARDS ZERO
615,Wisconsin in Their Bones
616,Jandar of Callisto
620,Tarzan and the Lost Empire
622,LOST WORLD OF TIME
623,Jandar of Callisto
624,Alpha ou la mort
626,The Other Side of the Moon
629,GINGER STAR
631,Persuasion
633,Ultimate world
634,Under the Green Star
635,The Four Amber Novels
637,Selected Poems
638,13 West Street
639,NORTHANGER ABBEY REPRINT Edition
642,Cuneiform Texts From Babylonian Tablets in the British Museum Part XIX
643,Adventures of Sherlock Holmes
645,Conan the Swordsman
648,At Bertrams Hotel
651,David Copperfield
653,THE ADVENTURE OF THE UNIQUE DICKENSIANS
658,Conan the Swordsman
662,The Best of Edmond Hamilton
664,Hard Times
669,Persuasion
670,The Tiger Among Us
671,Jungle Tales Of Tarzan
672,The War of the Worlds
674,Beachheads in Space
675,Making of a Spy
680,The Shuttered Room
681,THE BEASTS OF TARZAN
683,The Ginger Star and The Hounds of Skaith
684,Lost World
688,The Long Tomorrow
690,The Beasts of Tarzan
695,The Age of Fable
699,Tarzan of the Apes
702,The Biographical Dictionary of Musicians
703,Fantastic February 1962 Volume 11 Number 2
704,HALFLING AND OTHER STORIES
706,The Starmen of Llyrdis
710,The Age of Fable
713,Thongor Fights the Pirates of Tarakus
721,IDEAS DE LOS EGIPCIOS SOBRE EL MAS ALLA
723,Pride and Prejudice
724,The Starmen of Llyrdis
726,Thongor Against the Gods
727,The Big Jump
728,The Age of Fable or Beauties of Mythology With a Foreword by Palmer Bovie
731,The Sixth Galaxy Reader
733,An August Derleth Reader
734,The Wind Leans West
737,The dolphins of Altair
738,Emily Dickinson
739,Silent Spring
740,Tarzan the Untamed
741,Other Worlds November 1952
742,Egyptian Magic
744,LES CHIENS DE SKAITH
746,The Quest of Kadji
748,Conan of the Isles
752,The memoirs of Sherlock Holmes
753,100 Books By August Deleth
755,Nicholas Nickleby
757,The Best of Leigh Brackett
758,Gods of Mars
762,The Return of the King
763,Body in the Library
766,Complete poems
768,The Doom That Came to Sarnath
770,The Big Jump
773,FANTASTIC OCTOBER 1975
781,An Occurrence at Owl Creek Bridge
782,Village Daybook
783,Life On The Mississippi
785,The Hound of the Baskervilles
787,Egyptian Magic
789,A Princess of Mars
790,Adventures of Sherlock Holmes
791,The Wizard of Lemuria
798,TIME TO COME
799,Time to Come
800,Northwest Smith
801,Treasury Of Life And Literature Volume Two
802,A Christmas Carol
806,The Complete Poems of Emily Dickinson
810,SWORD OF RHIANNON
812,The Lad and the Lion
816,The Big Jump
824,Mansfield Park
827,THE AGE OF CHIVALRY OR LEGENDS Of King Arthur
830,A Tale of Two Cities
832,planet stories pulp magazine 1952 november
836,Adventures of Solar Pons
840,Fungi from Yuggoth and Other Poems
847,Murder in Retrospect
848,LOST ON VENUS
853,Survivor and Others
854,Poems by Emily Dickinson
863,Conan Of the Isles
864,THE GINGER STAR
865,Elephants Can Remember
866,Tarzan Coloring Book
868,Sky Pirates of Callisto
872,The Complete Poems of Emily Dickinson
874,Light in August
876,New Poetry Out of Wisconsin
877,Egyptian Magic
880,Tower at the Edge of Time
881,In the Midst of Life and Other Stories
882,Sleeping Murder
884,The Beasts of Tarzan
885,A Christmas Carol
887,The Age of Fable or Stories of Gods and Heroes
896,THONGER OF LUMURIA
897,The Coming of the Terrans
901,Great Expectations
905,Tarzan and the Lost Empire
908,Tarzan of the Apes
909,The Black Star
912,Paper Magic
913,Adventures of Sherlock Holmes
914,Hickory Dickory Death
916,The Best of Edmond Hamilton
917,Stranger at Home
919,Mystery of Edwin Drood
921,Pride and Prejudice and Zombies
922,Postern of Fate
923,Myths to Live By
924,Lost World
926,Selected Poems Letters of Emily Dickinson
932,Death Comes as the End
934,Jandar of Callisto
939,THONGOR FIGHTS THE PIRATES OF TARAKUS
941,The roar of the twenties
944,The Exploits of Brigadier Gerard
945,Thongor Against the Gods
946,Pride and Prejudice and Zombies
948,THE LONG TOMORROW
951,Gertrude Barrows Bennett Science Fiction Collection
954,Selected Poems
956,The Milwaukee Road Its First Hundred Years
958,The Memoirs of Sherlock Holmes
961,The Regatta Mystery
966,Le masque de cthulhu
968,Star Wars The Empire Strikes Back The Marvel Comics Version
972,The Mousetrap and Other Plays
974,The Halfling and Other Stories
978,Casebook of Sherlock Holmes and His Last Bow
979,Postern of Fate
980,Wind Over Wisconsin
981,FANTASTIC ADVENTURES APRIL 1945 VOLUME 7 NUMBER 2
982,Swords In The Mist
985,Collected Writings of Ambrose Bierce
986,More Little Monsters
989,The Comedies
993,Egyptian Language Easy Lessons In Egyptian Hieroglyphics With Sign List
994,EL RASTTRO DE CTHULHU
998,Invisible Death
999,NEW WORLDS FOR OLD
1000,A PRAED STREET DOSSIER
1001,Flashing Swords 2
1003,Collected Poems of Emily Dickinson
1005,Saint Ignatius and the Company of Jesus
1013,Legends of Charlemagne
1014,The Rosetta Stone
1015,Persuasion
1017,Nicholas Nickleby
1018,The Lad and the Lion
1019,All That Anybody Knows
1025,BEACHHEADS IN SPACE
1029,Northanger Abbey
1033,On Our Way to the Future
1034,Book of Myths
1035,Rule Of Pachomius At Tabenna Or The Aske
1036,ARKHAM COLLECTOR 5
1039,13 West Street
1049,Les Pillards de Skaith
1050,Organ Building and Design
1054,Warlord of Mars
1059,The Adventures of Sherlock Holmes
1067,Selected Poems and Letters of Emily Dickinson
1069,Sky Pirates of Callisto
1071,Lost World of Time
1076,Outworlder
1077,BEYOND THE GATES OF DREAM
1079,On the Fringe
1081,The Rosetta stone
1082,Silent Spring
1083,STORIE MARZIANE
1085,Flare
1086,The Man Who Loved Mars
1087,From the Caves and Jungles of Hindostan
1088,WEIRD TALES NOVEMBER 1953
1092,THE ARKHAM COLLECTOR
1096,The Hounds of Skaith
1097,WORLDS OF TOMORROW Clarke Leiber Tenn Sturgeon Derleth
1101,THE STARMEN OF LLYRDIS
1105,OTHER WORLDS OCTOBER 1951
1106,New Worlds for Old
1107,Tower at the Edge of Time
1108,Father Marquette and the Great Rivers
1113,Poirot Investiga
1118,The Age of Fable
1119,Future Tense
1120,A Study in Scarlet
1122,Lost World of Time
1124,The COMING Of The TERRANS
1125,The Dragon in the Sword
1127,Amulets and Superstitions
1128,The Ginger Star
1130,The Beasts Of Tarzan
1131,The Chessmen of Mars
1134,JANDAR OF CALLISTO
1137,The Frankenstein Reader
1140,Thongor Fights the Pirates of Tarakus
1141,The Wind Leans West
1142,The House on the Mound
1146,Conan the Buccaneer 6
1148,A Holiday for Murder
1151,Back To The Stone Age
1152,Tarzan Triumphant
1153,One Hundred and One Famous Poems
1154,Evil under the Sun
1157,Curtain
1158,Experience And Expression
1159,The Book of the Dead
1162,The Poetry Of Emily Dickinson
1164,OTHER WORLDS 1953 FEBRUARY
1166,Mischief in the Lane
1170,The House on the Mound
1172,Christmas Carol
1173,Silent Spring
1174,The Chessmen of Mars
1175,Conan Of the Isles
1178,British Mystery Multipack 13
1179,Empire Of The Necromancers And Three Others
1180,The Starmen of Llyrdis
1186,Egyptian Magic
1188,The Hounds of Skaith
1189,FANTASTIC FEBRUARY 1975
1190,A Christmas Carol and Other Stories
1192,Restless is The River
1193,Time To Come
1194,Time to Come
1196,Thrilling Wonder Stories June 1949
1199,The Gold of the Gods
1200,The House on the Mound
1203,TOWER AT THE EDGE OF TIME
1204,Thongor Against the Gods
1205,Thongor Against the Gods
1208,The Englishwoman in Egypt
1210,Hickory Dickory Death
1214,Introduction to Emily Dickinson
1215,Tarzan of the Apes
1217,From Other Worlds
1224,People of the Talisman and The Secret of Sinharat
1227,REAVERS OF SKAITH
1228,The Nemesis from Terra
1231,Conan Of The Isles
1232,Stranger at Home
1233,Emily Dickinson Letters
1236,sleeping murderthe murder at the vicarage
1239,The One Safe Place
1242,The Complete Sherlock Holmes Volume Two
1244,Empire Of The Necromancers And Three Others
1250,MEMOIRS OF SOLAR PONS
1252,Time To Come
1254,LA ESPADA DE RHIANNON
1255,Beacheads in Space
1258,Final Harvest
1269,The Lurker at the Threshold
1270,Pride and Prejudice and Zombies
1271,Death in the Air
1272,Le Secret de Sinharat
1273,A Study in Scarlet
1274,The Master Mind of Mars
1276,The Man Who Loved Mars
1277,Partners in Crime
1280,A FIGHTING MAN OF MARS
1281,The dolphins of Altair
1288,TOWER AT THE EDGE OF TIME
1295,super science stories pulp magazine 1942 october
1299,Favorite Poems of Emily Dickinson
1300,Gullivers Travels Illustrated By Luis Quintanilla
1302,Tarzan and the Forbidden City
1305,Saint Ignatius and the Company of Jesus
1308,Mansfield Park
1312,An Egyptian Reading Book
1313,The Case Book of Sherlock Holmes
1316,THE RETURN OF SHERLOCK HOLMES by ARTHUR CONAN DOYLE
1317,Mabinogion
1321,NO LIMITS
1323,A Princess of Mars
1329,The Wizard of Zao
1333,Hard Times
1334,Collected Poems
1335,The Chessmen of Mars
1336,Emma
1339,A Tale of Two Cities
1346,The Wind Leans West
1349,THE AGE OF FABLE OR THE BEAUTIES OF MYTHOLOGY
1352,Gullivers Travels Illustrated By Luis Quintanilla
1353,The collected writings of Ambrose Bierce
1354,The Vampyre
1355,Studies in Occultism
1359,TWO POEMS
1361,Thongor and the Wizard of Lemuria
1362,At the Earths Core
1364,Valley of Fear
1367,OTHER WORLDS 1952 NOVEMBER
1371,The Three Imposters
1377,Obsession
1379,The Shadow in The Glass
1382,Great Expectations
1385,Contes noirs
1387,Crooked House
1389,SUPER SCIENCE stories pulp magazine 1942 february
1392,Death on the Nile
1395,A Caribbean Mystery
1396,LE PEUPLE DU TALISMAN
1399,Three Times Infinity
1401,UNA MARTIR DEL SIGLO XIX
1403,Ich war das Opfer
1406,THE MOON MAID
1407,Tarzan of the Apes
1409,Three Tales of Horror
1413,Thongor in the City of Magicians
1414,The Man Who Loved Mars
1417,Tower at the Edge of Time
1420,Persuasion
1424,Study In Scarlet
1425,Tarzan and the Lost Empire
1427,From the Caves and Jungles of the Hindostan
1428,The Vampyre
1429,The Age of Chivalry or Legends of King Arthur
1430,Myths of Greece and Rome
1433,The Lurker at the Threshold
1435,The Shadow in the Glass
1436,The Night of the Wolf
1441,No Good From A Corpse
1442,Thongor and The Wizard of Lemuria
1443,By the light of the Green Star
1447,Stellar Short Novels
1449,Empire of Fur Trading in the Lake Superior Region
1451,Legends Of The Gods
1453,The House on the Mound
1454,STRANGE PORTS OF CALL
1455,The Age of Fable or Beauties of Mythology
1458,OTHER WORLDS 1952 JULY
1459,The Beasts of Tarzan
1461,The Hounds of Skaith 2
1462,The Lurker At the Threshold
1463,The Gold of the Gods
1464,THE AGE OF FABLE or STORIES OF GODS AND HEROES
1470,The Big Jump
1471,REAVERS OF SKAITH
1479,18 Best Stories by Edgar Allan Poe
1480,WEIRD TALES SEPTEMBER 1952
1482,Poemas
1483,The Trail of Cthulhu
1490,Something About Eve
1493,The Lurker at the Threshold
1494,TIME TO COME
1498,Elephants Can Remember
1506,Through the Magic Door
1507,The Nameless
1511,The Son of Tarzan
1514,Conan the Swordsman
1515,Strange Ports of Call
1517,Sense and Sensibility
1519,Mythology
1523,A Letter to the World
1524,Three Times Infinity
1526,The Ginger Star
1529,THE OUTLAW OF TORN by EDGAR RICE BURROUGHS
1530,Black Legion of Callisto
1532,The Original Illustrated Sherlock Holmes
1533,The Long Tomorrow
1538,The Age of Fable
1540,Stellar Short Novels
1543,FROM OTHER WORLDS
1544,The Key to Theosophy
1547,Emerson Our Contemporary
1550,The Hounds of Skaith
1551,Beyond the Gates of Dream
1554,Stories of Gods and Heroes
1555,Persuasion
1556,The Complete Sherlock Holmes
1558,Thongor at the End of Time
1560,Conan of Aquilonia
1561,The Hound of the Baskervilles
1563,Crooked House
1564,THE SWORD OF RHIANNON
1565,Ultimate world
1568,Bright Journey
1570,Black Legion of Callisto
1572,The Star King
1573,Tale of Two Cities
1575,A Christmas Carol
1579,LANKAR OF CALLISTO
1592,LOST WORLD OF TIME
1593,Under the Green Star
1594,The Original Illustrated Sherlock Holmes
1598,Wind Over Wisconsin
1601,THE GINGER STAR
1602,The Moon Maid
1603,Babylonian Story of the Deluge
1604,The People That Time Forgot
1608,They Came to Baghdad
1613,Discoveries in Fantasy
1614,Poems for Youth
1615,Conan of the Isles
1616,The Complete Sherlock Holmes
1625,The Starmen of Llyrdis
1626,Poems for Youth
1627,Silent Spring
1628,Thongor and the Dragon City
1629,The House on the Mound
1631,Pride and Prejudice
1633,Adventures and Memoirs of Sherlock Holmes
1634,A Charles Dickens Christmas
1635,The Sword of Rhiannon
1638,Legends of the Gods the Egyptian Texts
1639,Truth Quest Inductive Student Bible
1640,Sleeping Murder
1642,Famous Science Fiction Volume 1 Number 1
1643,Acts of Light
1644,The Mummy
1645,Poems Series 2
1652,THE HOUNDS OF SKAITH
1653,the clocks
1654,Thongor Fights the Pirates of Tarakus
1657,Tarzan and the Forbidden City
1660,Hound of the Baskervilles
1662,El Cuadro
1664,A Tale of Two Cities
1667,Organ building and design
1669,Legends Of The Age Of Darkness
1670,Chessmen of Mars
1680,The Land Leviathan
1682,The Prince Goes West
1685,Walden West
1686,Diabolical Definitions
1687,Hard Times
1692,TOWER AT THE EDGE OF TIME
1695,Hard Times
1696,Invisible Death
1697,The Mad King
1698,EGYPTIAN MAGIC
1699,THE OTHER SIDE OF THE MOON
1703,Sweet Genevieve
1704,Silent Spring
1705,The Mummy
1706,The Lost Continent
1710,La legge dei vardda
1717,THE AGE OF FABLE by THOMAS BULFINCH
1720,THE MAGAZINE OF FANTASY AND SCIENCE FICTION JULY 1953
1722,Beyond the Gates of Dream
1724,Mansfield Park
1729,Survivor and Others
1732,Tarzan and the Leopard Men
1733,Strange Ports of Call
1737,The Age of Chivalry
1740,Tarzan the Untamed
1743,The City Outside the World
1745,Lurker at the Threshold
1746,The Mothman Prophecies
1747,Tolkien Look Behind
1749,New Poems of Emily Dickinson
1754,The Adventures of Sherlock Holmes
1756,The Hound of the Baskervilles
1758,JANDAR OF CALLISTO
1763,The Age Of Chivalry And Legends of Charlemagne or Romance Of The Middle Ages
1764,TIME WAR
1766,The Artificial Man And Other Stories
1767,The Master Mind of Mars
1772,THONGOR AND THE DRAGON CITY
1776,Cuneiform Texts From Babylonian Tablets in the British Museum Part XXXI
1779,BARBARIANS AND BLACK MAGICIANS
1781,Emma
1782,The Memoirs Of Sherlock Holmes
1789,Star Rogue
1791,Civil War Stories
1792,Mark Twain Reader
1794,The Quest of Kadji
1795,Tarzan the Untamed
1799,A Pocketful of Rye
1802,THONGOR OF LEMURA
1804,THE GINGER STAR
1808,Poems for Youth
1810,Egyptian Magic
1812,Lankar of Callisto
1813,From the Caves and Jungles of Hindostan
1814,holiday for Murder
1815,The Key To Theosophy
1816,The Spawn of Cthulhu
1819,Mythology
1823,Tales of the Cthulhumythos Volume 1
1825,ATLANTIS the Antediluvian World
1828,The Long Tomorrow
1829,The Mummy
1833,Tales of the Occult
1834,LE SECRET DE SINHARAT
1836,The City Outside the World
1838,The Nemesis from Alpha
1840,The Divine Origin of the Craft of the Herbalist
1842,Emily Dickinson Selected Poems
1846,Tarzan of the Apes
1847,WHEN THE GREEN STAR CALLS
1848,The Voice of the Silence
1850,Time to Come
1852,Selected Poems and Letters of Emily Dickinson
1854,Easy To Kill
1856,The War Chief
1858,The Cocktail Party
1859,Sky Pirates of Callisto
1864,Ordeal by Innocence
1868,THE MAN WHO LOVED MARS
1869,King Dragon
1874,The Tomb and Other Tales
1877,The Lurker at the Threshold
1878,The Black Star
1881,No Limits
1882,WHEN THE GREEN STAR CALLS
1883,Hawk on the Wind
1885,Tarzan and the Lost Empire
1891,THE TIME OF INFINITY
1893,The Flame of Iridar and Pericl of the Starmen
1897,The Big Jump
1898,The Age of Fable
1899,Black Legion of Callisto
1900,New Poems of Emily Dickinson
1902,The Reminiscences of Solar Pons
1904,THE WIZARD OF ZAO
1913,Egyptian Magic
1915,Intruder in the Dust
1917,Oliver Twist
1919,THE COMING OF THE TERRANS gga
1923,Great Expectations
1924,LES HOMMES STELLAIRES
1926,BEYOND THE GATES OF DREAM
1927,Tower at the Edge of Time
1937,Vettius and His Friends
1938,The Wizard of Lemuria
1941,Amazing Fact and Science Fiction Stories Vol 37 No 5 May 1963
1942,Travels with Henry James
1943,A Caribbean Mystery
1944,The Hounds of Skaith
1946,A Christmas Carol
1948,Rosetta Stone
1955,Final Harvest
1957,The Age of Fable Or The Beauties of Mythology
1959,Alpha Centauri sehen und sterben
1960,FANTASTIC ADVENTURES PULP MAGAZINE 1945 april
1968,The Lad and the Lion
1969,THONGOR AT THE END OF TIME
1970,Time War
1971,Escape Across the Cosmos
1972,Writing Fiction
1973,Mansfield Park
1979,A Study In Scarlet
1980,Return of Sherlock Holmes
1981,The Further Adventures of Romney Pringle
1984,Poems by Emily Dickinson
1988,The Wizard of Zao
1990,The Son of Tarzan
1993,Thongor Fights the Pirates of Tarakus
1994,Jungle Tales of Tarzan
1997,Egyptian Magic
1998,The Adventures of Sherlock Holmes
1999,The Chronicles of Solar Pons
2001,The Hounds of Skaith
2002,The Chronicles of Amber Volume 11
2004,Conan Of The Isles
2011,In the Midst of Life and Other Tales
2013,The God of the Witches
2014,Dagon and other Macabre Tales
2016,Passenger to Frankfurt
2017,Tarzan and the Foreign Legion
2018,The Age of Fable
2019,The Complete Poems of Emily Dickinson
2022,Le Peuple du talisman
2024,FANTASTIC JULY 1974
2026,Egyptian Religion
2029,The Original Illustrated Sherlock Holmes
2030,The Shuttered Room and Other Tales of Horror
2031,Tarzan and the Castaways
2032,Great Expectations
2034,Stories and Fables
2035,Bright Journey
2036,The Sanford Guide to Antimicrobial Therapy 2011
2037,FANTASTIC STORY SUMMER 1952
2039,The Hills Stand Watch
2040,Turkler Uzerine Makaleler
2041,La espada de Rhiannon
2042,Murder After Hours
2043,Murder on the Orient Express
2049,The Age of Fable or Stories of Gods and Heroes
2051,Organ Building and Design
2052,Hickory Dickory Death
2053,Time To Come
2054,La espada De Rhiannon
2056,THE GINGER STAR
2058,FAR BOUNDARIES
2059,Double Sin and other stories
2060,The Ginger Star
2062,The Reavers of Skaith
2067,The Mummy
2068,Silent Spring
2072,The Egyptian Book of the Dead
2073,From the Caves and Jungles of Hindostan
2077,Curtain
2078,CARDS ON THE TABLE
2080,Der letzte Joker
2082,The Hashish Man and Other Stories
2084,The Mucker
2085,Emma
2087,TIME WAR
2090,Mad Empress of Callisto
2093,Love Poems
2096,Beyond The Gate Of Dream
2097,The Regatta Mystery
2101,Le Peuple du talisman
2105,The Metal Monster
2109,Pride and Prejudice and Zombies
2111,planet stories pulp magazine 1949 summer
2114,The Age Of Chivalry
2115,Bright Journey
2117,Collected Poems Of Emily Dickinson
2123,Love Poems
2124,THE AGE OF FABLE
2130,Callipygia
2131,Swords In The Mist
2134,Twelve Emily Dickinson Bookmarks
2135,The Laurel Poetry Series Selected Poetry of Emily Dickinson
2137,Queen of the Martian Catacombs
2144,When Evil Walks
2151,The Age of Fable Or The Beauties of Mythology
2156,The Memoirs of Sherlock Holmes
2159,Ylana of Callisto
2160,Emily Dickinson
2163,The Master Mind of Mars
2164,Selected Poems
2166,Jandar of Callisto
2167,A Christmas Carol
2172,Restless is the River
2173,Love Poems
2175,THE NEMESIS FROM TERRA bound with COLLISION COURSE
2176,The Return of Sherlock Holmes
2179,The Coming Of The Terrans
2188,Egyptian Magic
2191,The Mabinogion Library of Essential Reading Series
2194,Wisconsin Country
2195,By the light of the Green Star
2196,Opactwo Northanger
2200,Little Dorrit
2201,Egyptian Language
2202,Beyond Time and Space
2207,Silent Spring
2216,A Study in Scarlet
2217,Selected Poems and Letters of Emily Dickinson
2218,Egyptian Magic
2220,STRANGER AT HOME
2221,Time to Come
2222,THE BIG TIME by FRITZ LEIBER
2228,Conan the Swordsman
2229,The Hound of the Baskervilles
2232,Poems by Emily Dickinson
2234,Curtain
2242,The Cocktail Party
2244,Tarzan And The Golden Lion
2245,Thongor of Lemuria
2247,Conan the Wanderer
2248,The Hashish Man and Other Stories
2249,FLASHING SWORDS 2
